{"artifactId":"742c3cdd-d04d-49e8-a7f9-d783d178faac","branchCoherenceSignals":["participant branches stay lawful under the declared support topology","branch witnesses remain pointerized and bounded","branch roles remain distinct while sharing one support claim","branch-set remains stable under later reviewable support pressure"],"branchCoherenceStatus":"coherent_support","branchSetId":"742c3cdd-d04d-49e8-a7f9-d783d178faac-branch-set","claimSurface":"candidate_support_evidence","constructorSupportStatus":"branch_traceable","evidenceClass":"engram_candidacy_evidence","inspectionPosture":"mixed_pointerized","intentClassification":"reviewable_support_evidence","participantBranches":[{"branchId":"branch-operator","role":"operator-facing","supportState":"supported_intent"},{"branchId":"branch-witness","role":"witness-facing","supportState":"reviewable_support"},{"branchId":"branch-audit","role":"audit-facing","supportState":"supported_intent"}],"phase5HandoffReady":true,"protectedEvidenceRefs":[{"digestSha256":"5e26d8a9a01163862d307f4750133aa87830a24fb53f01a3b31639973fbc90de","pointerUri":"custody://engram/branch-set","refId":"engram-branch","summary":"Protected branch-set evidence for participatory support"}],"provenanceBasis":"phase3_temporal_support","schema":"oan.hopng_participatory_engram","schemaVersion":"0.1.0","supportOnly":true,"supportShape":"branch_set_support","validationQuestions":["Do participant branches remain distinct while sharing one lawful branch set?","Is the support evidence strong enough for later human review without implying acceptance?","Do added participant-facing branches preserve one lawful support branch set?"],"workingIntentState":"reviewable_support"}